{
  "schema_version": "0.1.0",
  "graph_id": "PARTS-EVIDENCE-001",
  "as_of_date": "2026-10-18",
  "target_market": "ZA",
  "status": "synthetic_contract_examples_only",
  "claim_ceiling": "synthetic_examples_are_not_real_fitment_supply_repair_or_safety_evidence",
  "models": [
    {
      "model_id": "SYN-MODEL-WASHER-A",
      "family_id": "F1-WASHER",
      "model_token": "SYN-WASHER-A",
      "revision_token": "SYN-REV-A",
      "market_code": "ZA",
      "serial_scope": "unknown",
      "serial_from_token": null,
      "serial_to_token": null,
      "evidence_class": "synthetic_fixture"
    },
    {
      "model_id": "SYN-MODEL-WASHER-B",
      "family_id": "F1-WASHER",
      "model_token": "SYN-WASHER-B",
      "revision_token": "SYN-REV-B",
      "market_code": "ZA",
      "serial_scope": "known_window",
      "serial_from_token": "SYN-SN-1000",
      "serial_to_token": "SYN-SN-1999",
      "evidence_class": "synthetic_fixture"
    },
    {
      "model_id": "SYN-MODEL-HVAC-A",
      "family_id": "F7-RESIDENTIAL-HVAC",
      "model_token": "SYN-HVAC-A",
      "revision_token": "SYN-REV-C",
      "market_code": "ZA",
      "serial_scope": "unknown",
      "serial_from_token": null,
      "serial_to_token": null,
      "evidence_class": "synthetic_fixture"
    }
  ],
  "parts": [
    {
      "part_id": "SYN-PART-PUMP-A",
      "manufacturer_part_token": "SYN-MPN-PUMP-A",
      "part_type": "drain pump assembly",
      "revision_token": "SYN-PARTREV-1",
      "safety_criticality": "controlled",
      "evidence_class": "synthetic_fixture"
    },
    {
      "part_id": "SYN-PART-SEAL-A",
      "manufacturer_part_token": "SYN-MPN-SEAL-A",
      "part_type": "door seal",
      "revision_token": "SYN-PARTREV-2",
      "safety_criticality": "controlled",
      "evidence_class": "synthetic_fixture"
    },
    {
      "part_id": "SYN-PART-VALVE-A",
      "manufacturer_part_token": "SYN-MPN-VALVE-A",
      "part_type": "water inlet valve",
      "revision_token": "SYN-PARTREV-1",
      "safety_criticality": "controlled",
      "evidence_class": "synthetic_fixture"
    },
    {
      "part_id": "SYN-PART-PUMP-OLD",
      "manufacturer_part_token": "SYN-MPN-PUMP-OLD",
      "part_type": "superseded pump assembly",
      "revision_token": "SYN-PARTREV-0",
      "safety_criticality": "controlled",
      "evidence_class": "synthetic_fixture"
    },
    {
      "part_id": "SYN-PART-FAN-A",
      "manufacturer_part_token": "SYN-MPN-FAN-A",
      "part_type": "HVAC fan assembly",
      "revision_token": "SYN-PARTREV-3",
      "safety_criticality": "high",
      "evidence_class": "synthetic_fixture"
    }
  ],
  "evidence": [
    {
      "evidence_id": "SYN-EV-001",
      "evidence_kind": "manufacturer_catalogue",
      "evidence_class": "synthetic_fixture",
      "source_token": "SYN-SOURCE-CATALOGUE",
      "source_url": null,
      "captured_on": "2026-10-18",
      "artifact_sha256": "aaaaaaaaaaaaaaaaaaaaaaaaaaaaaaaaaaaaaaaaaaaaaaaaaaaaaaaaaaaaaaaa",
      "empirical_eligible": false,
      "notes": "Synthetic scenario: model-specific manufacturer listing, not a fit/function test."
    },
    {
      "evidence_id": "SYN-EV-002",
      "evidence_kind": "seller_claim",
      "evidence_class": "synthetic_fixture",
      "source_token": "SYN-SOURCE-SELLER",
      "source_url": null,
      "captured_on": "2026-10-18",
      "artifact_sha256": "aaaaaaaaaaaaaaaaaaaaaaaaaaaaaaaaaaaaaaaaaaaaaaaaaaaaaaaaaaaaaaaa",
      "empirical_eligible": false,
      "notes": "Synthetic scenario: seller text claims an item fits; no authoritative fit test is present."
    },
    {
      "evidence_id": "SYN-EV-003",
      "evidence_kind": "cross_reference",
      "evidence_class": "synthetic_fixture",
      "source_token": "SYN-SOURCE-CROSSREF",
      "source_url": null,
      "captured_on": "2026-10-18",
      "artifact_sha256": "aaaaaaaaaaaaaaaaaaaaaaaaaaaaaaaaaaaaaaaaaaaaaaaaaaaaaaaaaaaaaaaa",
      "empirical_eligible": false,
      "notes": "Synthetic scenario: unverified cross-reference relationship only."
    },
    {
      "evidence_id": "SYN-EV-004",
      "evidence_kind": "physical_fit_test",
      "evidence_class": "synthetic_fixture",
      "source_token": "SYN-SOURCE-CATALOGUE",
      "source_url": null,
      "captured_on": "2026-10-18",
      "artifact_sha256": "aaaaaaaaaaaaaaaaaaaaaaaaaaaaaaaaaaaaaaaaaaaaaaaaaaaaaaaaaaaaaaaa",
      "empirical_eligible": false,
      "notes": "Synthetic scenario: controlled physical-fit check record."
    },
    {
      "evidence_id": "SYN-EV-005",
      "evidence_kind": "functional_test",
      "evidence_class": "synthetic_fixture",
      "source_token": "SYN-SOURCE-CATALOGUE",
      "source_url": null,
      "captured_on": "2026-10-18",
      "artifact_sha256": "aaaaaaaaaaaaaaaaaaaaaaaaaaaaaaaaaaaaaaaaaaaaaaaaaaaaaaaaaaaaaaaa",
      "empirical_eligible": false,
      "notes": "Synthetic scenario: controlled function-check record."
    },
    {
      "evidence_id": "SYN-EV-006",
      "evidence_kind": "functional_test",
      "evidence_class": "synthetic_fixture",
      "source_token": "SYN-SOURCE-CATALOGUE",
      "source_url": null,
      "captured_on": "2026-10-18",
      "artifact_sha256": "aaaaaaaaaaaaaaaaaaaaaaaaaaaaaaaaaaaaaaaaaaaaaaaaaaaaaaaaaaaaaaaa",
      "empirical_eligible": false,
      "notes": "Synthetic scenario: second functional verification receipt."
    },
    {
      "evidence_id": "SYN-EV-007",
      "evidence_kind": "negative_fit_test",
      "evidence_class": "synthetic_fixture",
      "source_token": "SYN-SOURCE-CATALOGUE",
      "source_url": null,
      "captured_on": "2026-10-18",
      "artifact_sha256": "aaaaaaaaaaaaaaaaaaaaaaaaaaaaaaaaaaaaaaaaaaaaaaaaaaaaaaaaaaaaaaaa",
      "empirical_eligible": false,
      "notes": "Synthetic scenario: measured interface mismatch and explicit incompatibility disposition."
    },
    {
      "evidence_id": "SYN-EV-008",
      "evidence_kind": "supersession_record",
      "evidence_class": "synthetic_fixture",
      "source_token": "SYN-SOURCE-CATALOGUE",
      "source_url": null,
      "captured_on": "2026-10-18",
      "artifact_sha256": "aaaaaaaaaaaaaaaaaaaaaaaaaaaaaaaaaaaaaaaaaaaaaaaaaaaaaaaaaaaaaaaa",
      "empirical_eligible": false,
      "notes": "Synthetic scenario: dated record identifies that an older part mapping is superseded."
    },
    {
      "evidence_id": "SYN-EV-009",
      "evidence_kind": "physical_fit_test",
      "evidence_class": "synthetic_fixture",
      "source_token": "SYN-SOURCE-CATALOGUE",
      "source_url": null,
      "captured_on": "2026-10-18",
      "artifact_sha256": "aaaaaaaaaaaaaaaaaaaaaaaaaaaaaaaaaaaaaaaaaaaaaaaaaaaaaaaaaaaaaaaa",
      "empirical_eligible": false,
      "notes": "Synthetic scenario: physical fit record for the HVAC fan part."
    },
    {
      "evidence_id": "SYN-EV-010",
      "evidence_kind": "functional_test",
      "evidence_class": "synthetic_fixture",
      "source_token": "SYN-SOURCE-CATALOGUE",
      "source_url": null,
      "captured_on": "2026-10-18",
      "artifact_sha256": "aaaaaaaaaaaaaaaaaaaaaaaaaaaaaaaaaaaaaaaaaaaaaaaaaaaaaaaaaaaaaaaa",
      "empirical_eligible": false,
      "notes": "Synthetic scenario: functional verification record for the HVAC fan part."
    },
    {
      "evidence_id": "SYN-EV-011",
      "evidence_kind": "safety_qualification",
      "evidence_class": "synthetic_fixture",
      "source_token": "SYN-SOURCE-CATALOGUE",
      "source_url": null,
      "captured_on": "2026-10-18",
      "artifact_sha256": "aaaaaaaaaaaaaaaaaaaaaaaaaaaaaaaaaaaaaaaaaaaaaaaaaaaaaaaaaaaaaaaa",
      "empirical_eligible": false,
      "notes": "Synthetic scenario: qualified-scope safety verification record."
    },
    {
      "evidence_id": "SYN-EV-012",
      "evidence_kind": "delivery_receipt",
      "evidence_class": "synthetic_fixture",
      "source_token": "SYN-SOURCE-UPSTREAM-1",
      "source_url": null,
      "captured_on": "2026-10-18",
      "artifact_sha256": "aaaaaaaaaaaaaaaaaaaaaaaaaaaaaaaaaaaaaaaaaaaaaaaaaaaaaaaaaaaaaaaa",
      "empirical_eligible": false,
      "notes": "Synthetic scenario: one physical delivery and inspection receipt."
    },
    {
      "evidence_id": "SYN-EV-013",
      "evidence_kind": "delivery_receipt",
      "evidence_class": "synthetic_fixture",
      "source_token": "SYN-SOURCE-UPSTREAM-1",
      "source_url": null,
      "captured_on": "2026-10-18",
      "artifact_sha256": "aaaaaaaaaaaaaaaaaaaaaaaaaaaaaaaaaaaaaaaaaaaaaaaaaaaaaaaaaaaaaaaa",
      "empirical_eligible": false,
      "notes": "Synthetic scenario: another retailer delivery receipt but from the same upstream supply group."
    },
    {
      "evidence_id": "SYN-EV-014",
      "evidence_kind": "supplier_quote",
      "evidence_class": "synthetic_fixture",
      "source_token": "SYN-SOURCE-UPSTREAM-2",
      "source_url": null,
      "captured_on": "2026-10-18",
      "artifact_sha256": "aaaaaaaaaaaaaaaaaaaaaaaaaaaaaaaaaaaaaaaaaaaaaaaaaaaaaaaaaaaaaaaa",
      "empirical_eligible": false,
      "notes": "Synthetic scenario: written quote from a separate upstream supplier group."
    }
  ],
  "compatibility_claims": [
    {
      "claim_id": "SYN-COMP-001",
      "model_id": "SYN-MODEL-WASHER-A",
      "model_revision_token": "SYN-REV-A",
      "part_id": "SYN-PART-PUMP-A",
      "model_revision_scope": "exact_revision",
      "market_code": "ZA",
      "serial_scope": "unknown",
      "effective_from": "2024-01-01",
      "effective_until": null,
      "claim_status": "manufacturer_listed_only",
      "physical_fit_check": "not_assessed",
      "functional_check": "not_assessed",
      "safety_qualification": "not_assessed",
      "evidence_ids": [
        "SYN-EV-001"
      ],
      "superseded_by_claim_id": null,
      "empirical_eligible": false
    },
    {
      "claim_id": "SYN-COMP-002",
      "model_id": "SYN-MODEL-WASHER-A",
      "model_revision_token": "SYN-REV-A",
      "part_id": "SYN-PART-SEAL-A",